{
  "$schema": "https://json-schema.org/draft/2020-12/schema",
  "$id": "https://anchored-spec.dev/schemas/workflow-policy.schema.json",
  "title": "Anchored Spec — Workflow Policy",
  "description": "Governance rules: workflow variants, path-based enforcement, trivial exemptions, and lifecycle gates.",
  "type": "object",
  "required": [
    "workflowVariants",
    "changeRequiredRules",
    "trivialExemptions",
    "lifecycleRules"
  ],
  "properties": {
    "workflowVariants": {
      "type": "array",
      "minItems": 1,
      "items": {
        "type": "object",
        "required": ["id", "name", "defaultTypes", "artifacts"],
        "properties": {
          "id": {
            "type": "string",
            "pattern": "^[a-z]+(-[a-z]+)*$"
          },
          "name": { "type": "string" },
          "defaultTypes": {
            "type": "array",
            "items": {
              "type": "string",
              "enum": ["feature", "fix", "refactor", "chore"]
            },
            "description": "Change types that default to this variant"
          },
          "artifacts": {
            "type": "array",
            "items": { "type": "string" },
            "description": "Ordered list of artifacts this variant requires (e.g., 'requirements', 'design-doc', 'implementation-plan')"
          },
          "skipSkillSequence": {
            "type": "boolean",
            "default": false,
            "description": "If true, skip mandatory skill/ceremony sequence"
          },
          "verificationFocus": {
            "type": "array",
            "items": { "type": "string" },
            "description": "What to verify for this variant"
          }
        },
        "additionalProperties": false
      }
    },
    "changeRequiredRules": {
      "type": "array",
      "items": {
        "type": "object",
        "required": ["id", "include"],
        "properties": {
          "id": {
            "type": "string",
            "pattern": "^[a-z]+(-[a-z]+)*$"
          },
          "description": { "type": "string" },
          "include": {
            "type": "array",
            "items": { "type": "string" },
            "minItems": 1,
            "description": "Glob patterns — files matching these require a change record"
          },
          "exclude": {
            "type": "array",
            "items": { "type": "string" },
            "description": "Glob patterns — files matching these are excluded from this rule"
          },
          "requiredDocs": {
            "type": "array",
            "items": { "type": "string" },
            "description": "Documents that must exist for changes matching this rule"
          },
          "requiredDriftChecks": {
            "type": "array",
            "items": { "type": "string" },
            "description": "Drift check scripts to run"
          },
          "commands": {
            "type": "array",
            "items": { "type": "string" },
            "description": "Commands to run for changes matching this rule"
          }
        },
        "additionalProperties": false
      },
      "description": "Path-based rules that mandate change records"
    },
    "trivialExemptions": {
      "type": "array",
      "items": { "type": "string" },
      "description": "Glob patterns for paths that never require a change record"
    },
    "choreEligibility": {
      "type": "object",
      "properties": {
        "conditions": {
          "type": "array",
          "items": { "type": "string" },
          "description": "All conditions must be true for chore eligibility"
        },
        "escalationRule": {
          "type": "string",
          "description": "What happens when conditions are not met"
        }
      },
      "additionalProperties": false,
      "description": "When a change qualifies as a chore (lightweight workflow)"
    },
    "lifecycleRules": {
      "type": "object",
      "properties": {
        "plannedToActiveRequiresChange": {
          "type": "boolean",
          "default": true,
          "description": "REQ can't go active without a CHG"
        },
        "activeToShippedRequiresCoverage": {
          "type": "boolean",
          "default": true,
          "description": "REQ can't ship without test evidence"
        },
        "deprecatedRequiresReason": {
          "type": "boolean",
          "default": true,
          "description": "REQ can't be deprecated without a reason or replacement"
        }
      },
      "additionalProperties": false,
      "description": "Machine-enforced lifecycle transition gates"
    },
    "schemaVersion": {
      "type": "string",
      "description": "Schema version for migration tracking"
    }
  },
  "additionalProperties": false
}
