{
  "workflowVariants": [
    {
      "id": "feature-behavior-first",
      "name": "Feature (Behavior First)",
      "defaultTypes": ["feature"],
      "artifacts": ["requirements", "design-doc"],
      "verificationFocus": ["behavioral-coverage", "semantic-drift"]
    },
    {
      "id": "fix-root-cause-first",
      "name": "Fix (Root Cause First)",
      "defaultTypes": ["fix"],
      "artifacts": ["bugfix-spec"],
      "verificationFocus": ["regression-testing"]
    },
    {
      "id": "chore",
      "name": "Chore (Lightweight)",
      "defaultTypes": ["chore"],
      "artifacts": [],
      "skipSkillSequence": true,
      "verificationFocus": ["build-passes"]
    }
  ],
  "changeRequiredRules": [
    {
      "id": "source-change",
      "description": "Any source code change requires a change record",
      "include": ["src/**"],
      "exclude": ["src/**/*.test.*"]
    }
  ],
  "trivialExemptions": [
    "README.md",
    "*.md",
    "*.config.*",
    ".gitignore"
  ],
  "choreEligibility": {
    "conditions": [
      "No behavioral changes",
      "No new routes, error codes, or interfaces"
    ],
    "escalationRule": "If any condition fails, escalate to a full workflow variant"
  },
  "lifecycleRules": {
    "plannedToActiveRequiresChange": true,
    "activeToShippedRequiresCoverage": true,
    "deprecatedRequiresReason": true
  }
}
